{
  "schema_version": "1.0.0",
  "pack_id": "cricketlab-commentary-ordinary-v1",
  "pack_version": "1.0.0",
  "bank": "commentator_lines",
  "entries": [
    {
      "id": "clab.v1.commentator_lines.defence.bunnings.001",
      "category": "defence",
      "speaker": "bunnings",
      "requires": {
        "rec.wicket": null,
        "rec.extra.type": null,
        "rec.dropped": null,
        "rec.total": 0,
        "rec.padVerdict": "",
        "rec.shot": "defend",
        "rec.contact": "middle"
      },
      "text": "A perfectly reasonable use of a cricket bat.",
      "repeat_group": "commentator_lines.voice_defence_restraint",
      "weight": 1,
      "priority": 20,
      "cooldown_balls": 48
    },
    {
      "id": "clab.v1.commentator_lines.defence.bunnings.002",
      "category": "defence",
      "speaker": "bunnings",
      "requires": {
        "rec.wicket": null,
        "rec.extra.type": null,
        "rec.dropped": null,
        "rec.total": 0,
        "rec.padVerdict": "",
        "rec.shot": "defend",
        "rec.contact": "middle"
      },
      "text": "There is no extra charge for taking your time.",
      "repeat_group": "commentator_lines.voice_defence_restraint",
      "weight": 1,
      "priority": 20,
      "cooldown_balls": 48
    },
    {
      "id": "clab.v1.commentator_lines.defence.bunnings.003",
      "category": "defence",
      "speaker": "bunnings",
      "requires": {
        "rec.wicket": null,
        "rec.extra.type": null,
        "rec.dropped": null,
        "rec.total": 0,
        "rec.padVerdict": "",
        "rec.shot": "defend",
        "rec.contact": "middle"
      },
      "text": "The scoring can wait a ball.",
      "repeat_group": "commentator_lines.voice_defence_patience",
      "weight": 1,
      "priority": 20,
      "cooldown_balls": 48
    },
    {
      "id": "clab.v1.commentator_lines.defence.bunnings.004",
      "category": "defence",
      "speaker": "bunnings",
      "requires": {
        "rec.wicket": null,
        "rec.extra.type": null,
        "rec.dropped": null,
        "rec.total": 0,
        "rec.padVerdict": "",
        "rec.shot": "defend",
        "rec.contact": "middle"
      },
      "text": "A small piece of work, properly attended to.",
      "repeat_group": "commentator_lines.voice_defence_patience",
      "weight": 1,
      "priority": 20,
      "cooldown_balls": 48
    },
    {
      "id": "clab.v1.commentator_lines.defence.lorry.001",
      "category": "defence",
      "speaker": "lorry",
      "requires": {
        "rec.wicket": null,
        "rec.extra.type": null,
        "rec.dropped": null,
        "rec.total": 0,
        "rec.padVerdict": "",
        "rec.shot": "defend",
        "rec.contact": "middle"
      },
      "text": "Yes! Keep it out first, worry about the runs later!",
      "repeat_group": "commentator_lines.voice_defence_restraint",
      "weight": 1,
      "priority": 20,
      "cooldown_balls": 48
    },
    {
      "id": "clab.v1.commentator_lines.defence.lorry.002",
      "category": "defence",
      "speaker": "lorry",
      "requires": {
        "rec.wicket": null,
        "rec.extra.type": null,
        "rec.dropped": null,
        "rec.total": 0,
        "rec.padVerdict": "",
        "rec.shot": "defend",
        "rec.contact": "middle"
      },
      "text": "That's a ball dealt with! There's value in that!",
      "repeat_group": "commentator_lines.voice_defence_restraint",
      "weight": 1,
      "priority": 20,
      "cooldown_balls": 48
    },
    {
      "id": "clab.v1.commentator_lines.defence.lorry.003",
      "category": "defence",
      "speaker": "lorry",
      "requires": {
        "rec.wicket": null,
        "rec.extra.type": null,
        "rec.dropped": null,
        "rec.total": 0,
        "rec.padVerdict": "",
        "rec.shot": "defend",
        "rec.contact": "middle"
      },
      "text": "No run, but he's still there! That matters!",
      "repeat_group": "commentator_lines.voice_defence_patience",
      "weight": 1,
      "priority": 20,
      "cooldown_balls": 48
    },
    {
      "id": "clab.v1.commentator_lines.defence.lorry.004",
      "category": "defence",
      "speaker": "lorry",
      "requires": {
        "rec.wicket": null,
        "rec.extra.type": null,
        "rec.dropped": null,
        "rec.total": 0,
        "rec.padVerdict": "",
        "rec.shot": "defend",
        "rec.contact": "middle"
      },
      "text": "Bat on ball! Sometimes that's the whole job!",
      "repeat_group": "commentator_lines.voice_defence_patience",
      "weight": 1,
      "priority": 20,
      "cooldown_balls": 48
    },
    {
      "id": "clab.v1.commentator_lines.defence.grog.001",
      "category": "defence",
      "speaker": "grog",
      "requires": {
        "rec.wicket": null,
        "rec.extra.type": null,
        "rec.dropped": null,
        "rec.total": 0,
        "rec.padVerdict": "",
        "rec.shot": "defend",
        "rec.contact": "middle"
      },
      "text": "That ball didn't have to become a scoring shot.",
      "repeat_group": "commentator_lines.voice_defence_restraint",
      "weight": 1,
      "priority": 20,
      "cooldown_balls": 48
    },
    {
      "id": "clab.v1.commentator_lines.defence.grog.002",
      "category": "defence",
      "speaker": "grog",
      "requires": {
        "rec.wicket": null,
        "rec.extra.type": null,
        "rec.dropped": null,
        "rec.total": 0,
        "rec.padVerdict": "",
        "rec.shot": "defend",
        "rec.contact": "middle"
      },
      "text": "You can build an innings around leaving those alone on the scoreboard.",
      "repeat_group": "commentator_lines.voice_defence_restraint",
      "weight": 1,
      "priority": 20,
      "cooldown_balls": 48
    },
    {
      "id": "clab.v1.commentator_lines.defence.grog.003",
      "category": "defence",
      "speaker": "grog",
      "requires": {
        "rec.wicket": null,
        "rec.extra.type": null,
        "rec.dropped": null,
        "rec.total": 0,
        "rec.padVerdict": "",
        "rec.shot": "defend",
        "rec.contact": "middle"
      },
      "text": "Defence is a choice, not a defeat.",
      "repeat_group": "commentator_lines.voice_defence_patience",
      "weight": 1,
      "priority": 20,
      "cooldown_balls": 48
    },
    {
      "id": "clab.v1.commentator_lines.defence.grog.004",
      "category": "defence",
      "speaker": "grog",
      "requires": {
        "rec.wicket": null,
        "rec.extra.type": null,
        "rec.dropped": null,
        "rec.total": 0,
        "rec.padVerdict": "",
        "rec.shot": "defend",
        "rec.contact": "middle"
      },
      "text": "Make the bowler come back and do it again.",
      "repeat_group": "commentator_lines.voice_defence_patience",
      "weight": 1,
      "priority": 20,
      "cooldown_balls": 48
    },
    {
      "id": "clab.v1.commentator_lines.single.bunnings.001",
      "category": "single",
      "speaker": "bunnings",
      "requires": {
        "rec.wicket": null,
        "rec.extra.type": null,
        "rec.dropped": null,
        "rec.contact": "middle",
        "rec.runsBat": 1,
        "rec.total": 1,
        "rec.boundary": 0
      },
      "text": "They all count. Even the modest ones.",
      "repeat_group": "commentator_lines.voice_single_value",
      "weight": 1,
      "priority": 20,
      "cooldown_balls": 48
    },
    {
      "id": "clab.v1.commentator_lines.single.bunnings.002",
      "category": "single",
      "speaker": "bunnings",
      "requires": {
        "rec.wicket": null,
        "rec.extra.type": null,
        "rec.dropped": null,
        "rec.contact": "middle",
        "rec.runsBat": 1,
        "rec.total": 1,
        "rec.boundary": 0
      },
      "text": "The scorer has something to do.",
      "repeat_group": "commentator_lines.voice_single_value",
      "weight": 1,
      "priority": 20,
      "cooldown_balls": 48
    },
    {
      "id": "clab.v1.commentator_lines.single.bunnings.003",
      "category": "single",
      "speaker": "bunnings",
      "requires": {
        "rec.wicket": null,
        "rec.extra.type": null,
        "rec.dropped": null,
        "rec.contact": "middle",
        "rec.runsBat": 1,
        "rec.total": 1,
        "rec.boundary": 0
      },
      "text": "One is a useful number in this game.",
      "repeat_group": "commentator_lines.voice_single_patience",
      "weight": 1,
      "priority": 20,
      "cooldown_balls": 48
    },
    {
      "id": "clab.v1.commentator_lines.single.bunnings.004",
      "category": "single",
      "speaker": "bunnings",
      "requires": {
        "rec.wicket": null,
        "rec.extra.type": null,
        "rec.dropped": null,
        "rec.contact": "middle",
        "rec.runsBat": 1,
        "rec.total": 1,
        "rec.boundary": 0
      },
      "text": "A small deposit in the innings.",
      "repeat_group": "commentator_lines.voice_single_patience",
      "weight": 1,
      "priority": 20,
      "cooldown_balls": 48
    },
    {
      "id": "clab.v1.commentator_lines.single.lorry.001",
      "category": "single",
      "speaker": "lorry",
      "requires": {
        "rec.wicket": null,
        "rec.extra.type": null,
        "rec.dropped": null,
        "rec.contact": "middle",
        "rec.runsBat": 1,
        "rec.total": 1,
        "rec.boundary": 0
      },
      "text": "One more! Keep adding them!",
      "repeat_group": "commentator_lines.voice_single_value",
      "weight": 1,
      "priority": 20,
      "cooldown_balls": 48
    },
    {
      "id": "clab.v1.commentator_lines.single.lorry.002",
      "category": "single",
      "speaker": "lorry",
      "requires": {
        "rec.wicket": null,
        "rec.extra.type": null,
        "rec.dropped": null,
        "rec.contact": "middle",
        "rec.runsBat": 1,
        "rec.total": 1,
        "rec.boundary": 0
      },
      "text": "There's another run! Don't overlook those!",